{
  "schema_version": "0.1.0",
  "promotion_decision_id": "pd_evidence_only_001",
  "candidate_ref": "emb_projection_capability_001",
  "candidate_type": "EmbeddingCard",
  "decision": "evidence_only",
  "reason": "initial projection feature remains non-canonical until additional review",
  "top_score": 0.78,
  "runner_up_score": 0.61,
  "margin": 0.17,
  "perturbation_stability": 0.8,
  "evidence_count": 1,
  "policy_version": "regis-policy-v0.1.0",
  "gate_results": [
    {"gate": "consent-scope-gate", "state": "passed"},
    {"gate": "domain-transfer-gate", "state": "passed"},
    {"gate": "promotion-gate", "state": "evidence_only"}
  ],
  "reviewer": null,
  "created_at": "2026-05-04T18:33:00Z",
  "replay_hash": "sha256:promotion-replay"
}
